{
  "$schema":"https://json-schema.org/draft/2020-12/schema",
  "$id":"https://ptysd.invalid/schemas/csg/csg.checkpoint.v1.schema.json",
  "title":"CSG CheckpointOrEvent","type":"object","additionalProperties":false,
  "required":["schema_version","project_id","checkpoint_seq","transition_id","previous_checkpoint_ref","migration_anchor","event","mission_anchor","policy_anchor","controller_contract","verifier_digest","lifecycle","owner","run_ref","task_id","attempt_id","attempt_epoch","atomic","last_accepted","remote_wip","active_job_refs","unresolved_effect_refs","blockers","last_verified_gate","next_legal_transition","stop_requested","barrier","evidence_refs","recorded_at","payload_digest"],
  "properties":{
    "schema_version":{"const":"csg.checkpoint.v1"},"project_id":{"type":"string","minLength":1,"maxLength":128},"checkpoint_seq":{"type":"integer","minimum":1,"maximum":9007199254740991},"transition_id":{"type":"string","minLength":1,"maxLength":128},
    "previous_checkpoint_ref":{"type":["object","null"]},"migration_anchor":{"type":["object","null"]},
    "event":{"type":"object","additionalProperties":false,"required":["type","reason_code","subject_id"],"properties":{"type":{"enum":["ATOMIC_STARTED","ATOMIC_ACCEPTED","GATE_PASS","BLOCKED","WAITING_HUMAN","STOP","MISSION_REBASE","POLICY_REBASE","EFFECT_INTENT","DISPATCH_ARMED","EFFECT_RECONCILED","TERMINAL","DR_COMPLETED","MIGRATION_CUTOVER"]},"reason_code":{"type":"string","minLength":1,"maxLength":128},"subject_id":{"type":"string","minLength":1,"maxLength":128}}},
    "mission_anchor":{"type":"object","additionalProperties":false,"required":["ref","revision","declared_hash","canonicalization_version"],"properties":{"ref":{"type":"string","minLength":1,"maxLength":2048},"revision":{"type":"string","minLength":1,"maxLength":256},"declared_hash":{"type":"string","minLength":71,"maxLength":71},"canonicalization_version":{"type":"string","minLength":1,"maxLength":64}}},
    "policy_anchor":{"type":"object","additionalProperties":false,"required":["ref","revision","declared_hash","canonicalization_version"],"properties":{"ref":{"type":"string","minLength":1,"maxLength":2048},"revision":{"type":"string","minLength":1,"maxLength":256},"declared_hash":{"type":"string","minLength":71,"maxLength":71},"canonicalization_version":{"type":"string","minLength":1,"maxLength":64}}},
    "controller_contract":{"type":"string","minLength":1,"maxLength":256},"verifier_digest":{"type":"string","minLength":71,"maxLength":71},"lifecycle":{"enum":["ACTIVE","PAUSED","TERMINAL","ARCHIVED"]},
    "owner":{"anyOf":[{"type":"null"},{"type":"object","additionalProperties":false,"required":["principal_id","owner_generation","scope","lease_until"],"properties":{"principal_id":{"type":"string","minLength":1,"maxLength":128},"owner_generation":{"type":"integer","minimum":1,"maximum":9007199254740991},"scope":{"type":"string","minLength":1,"maxLength":256},"lease_until":{"type":"string"}}}]},
    "authorization_mode":{"type":["object","null"]},
    "run_ref":{"type":["object","null"]},"task_id":{"type":["string","null"],"maxLength":128},"attempt_id":{"type":["string","null"],"maxLength":128},"attempt_epoch":{"type":["integer","null"],"minimum":1,"maximum":9007199254740991},
    "atomic":{"type":["object","null"]},"last_accepted":{"type":["object","null"]},"remote_wip":{"type":["object","null"]},"active_job_refs":{"type":"array","maxItems":1},"unresolved_effect_refs":{"type":"array","maxItems":1},"blockers":{"type":"array","maxItems":32},"last_verified_gate":{"type":["object","null"]},
    "next_legal_transition":{"type":"object","additionalProperties":false,"required":["action","unit_id","requires","forbidden"],"properties":{"action":{"type":"string","minLength":1,"maxLength":128},"unit_id":{"type":["string","null"],"maxLength":128},"requires":{"type":"array","maxItems":32,"items":{"type":"string","maxLength":256}},"forbidden":{"type":"array","maxItems":32,"items":{"type":"string","maxLength":256}}}},
    "stop_requested":{"type":"boolean"},"barrier":{"enum":["CLEAN","ACTIVE_UNIT","RECONCILE_REQUIRED","WAITING_HUMAN"]},"evidence_refs":{"type":"array","maxItems":64},"recorded_at":{"type":"string"},"payload_digest":{"type":"string","minLength":71,"maxLength":71}
  }
}
