{"schema_version":"csg.checkpoint.v1","project_id":"CHATGPT_GLOBAL_SKILL_GOVERNANCE","checkpoint_seq":151,"transition_id":"GOV-HARDENING-P5-NPM-DIAGNOSTICS-PROCESS-RETRY-151","previous_checkpoint_ref":{"kind":"EXTERNAL_IMMUTABLE","provider":"GitHub","repository_id_or_resource_id":"1352411536","revision":"4ff8489c5b000372892419060eb295da761dacdd","path":"governance/csg/checkpoints/000150.json","digest":"sha256:f2dccbc3a3608602c58fd92953c6462bfa23e4e1990e1821ce6959b95f87bcd3"},"migration_anchor":null,"event":{"type":"ATOMIC_STARTED","reason_code":"P5_REGISTRY_REACHABLE_START_PROCESS_PATH_UNRELIABLE_SWITCH_EXECUTOR_PRIMITIVE","subject_id":"GOV-HARDENING-P5"},"mission_anchor":{"ref":"github://1352411536/governance/v49/current-mission.json@c57dd50c9c27b217fbd6dd2e4b38c7f7a3ddcd18","revision":"20260919T010100+0800","declared_hash":"sha256:58f21a0818bd60b61929925b38ea8507d5b80c09d816a7b6f5a75d2a410d542b","canonicalization_version":"HUMAN_TEXT_V1"},"policy_anchor":{"ref":"github://1352411536/governance/v49/current-execution-policy.json@c57dd50c9c27b217fbd6dd2e4b38c7f7a3ddcd18","revision":"20260919T010100+0800-EP71","declared_hash":"sha256:0dc535adfcf8c0bf1c12b1ff5e5191f5b74f267143403a41d77d626889eba861","canonicalization_version":"HUMAN_TEXT_V1"},"controller_contract":"CHAT_EXECUTION_POLICY_CONTRACT_V9_1_CANDIDATE","verifier_digest":"sha256:01cbbab08d423294e42dec679b46e5ebef9d06d2f1c3965de8f2bfb25711d4bf","lifecycle":"ACTIVE","owner":null,"run_ref":{"kind":"EXTERNAL_IMMUTABLE","provider":"GitHub","repository_id_or_resource_id":"1352411536","revision":"c57dd50c9c27b217fbd6dd2e4b38c7f7a3ddcd18","path":"runs/V49-CLOSURE-001/run.json","digest":"sha256:ab7916e3064473a38a45857b185bbedaea2d94bdab3196f2fe9b03be11ed599c"},"task_id":"GOV-HARDENING-P5","attempt_id":"GOV-HARDENING-P5-ATTEMPT-028","attempt_epoch":28,"atomic":{"contract_ref":{"kind":"HUMAN_DIRECTIVE","ref":"HUMAN_INDEPENDENT_GOVERNANCE_AUDIT_20260921"},"deadline_at":null,"state":"IN_PROGRESS","unit_id":"GOV-HARDENING-P5","goal":"P5_INSTALL_DEPENDENCIES_VIA_SYSTEM_DIAGNOSTICS_PROCESS","acceptance":["REGISTRY_HEAD_200","PREVIOUS_CACHE_EMPTY","NO_PREEXISTING_NODE_MODULES","DIAGNOSTICS_PROCESS_START","BOUNDED_WAIT_FOR_EXIT","NPM_CI_EXIT_ZERO","NODE_MODULES_PRESENT","CRITICAL_PACKAGES_PRESENT","PACKAGE_AND_LOCK_UNCHANGED","SUCCESS_MARKER_WRITTEN"],"execution_fence":{"schema":"v49.factory-mcp.execution-fence.v1","project_id":"CHATGPT_GLOBAL_SKILL_GOVERNANCE","mission_revision":"20260919T010100+0800","mission_hash":"sha256:58f21a0818bd60b61929925b38ea8507d5b80c09d816a7b6f5a75d2a410d542b","authorization_envelope_digest":"sha256:cb614427a0a1755d002cd035f50d33b18208bab7e5a9d8efc42dfbc7c4d99d14","run_id":"CHATGPT_GLOBAL_SKILL_GOVERNANCE-QUAL-P5","task_id":"GOV-HARDENING-P5","attempt_id":"GOV-HARDENING-P5-ATTEMPT-028","attempt_epoch":28,"operation_id":"GOV-HARDENING-P5-DIRECT-NPM-CI-001","operation_kind":"HOST_POWERSHELL","script_sha256":"sha256:3b88636773faa4db78313a3c679b2cdb9827edff19eab00f93f4a412ec6bcc4e","timeout_seconds":180,"capability_generation":4,"expires_at":"2026-09-22T04:30:00Z"}},"last_accepted":{"acceptance_transition_id":"GOV-HARDENING-P4-ACCEPTED-123","checkpoint_seq":123,"evidence_refs":[{"kind":"BUNDLE_OBJECT","path":"governance/csg/v49/gov-hardening-p4-current-attempt-fence-accepted-v1.json","digest":"sha256:265a44948ac3c527e7c1b0a7baf9baeefd82e9797e6aca9656418a9f962f931f"}],"unit_id":"GOV-HARDENING-P4"},"remote_wip":{"kind":"GITHUB_BRANCH","ref":"refs/heads/v49-p5-trusted-caller-authgen-candidate-20260921","head":"1f44bb9927cbc8b765d223c84d38757b0dd6c7e8","state":"P5_NPM_DIAGNOSTICS_PROCESS_RETRY"},"active_job_refs":[],"unresolved_effect_refs":[],"blockers":["P5_NPM_DIAGNOSTICS_PROCESS_RETRY_REQUIRED","P5_PARALLEL_STAGE_TESTS_NOT_PROVEN","DURABLE_OPERATION_CONSUMPTION_LIVE_NOT_PROVEN","ALL_MUTATING_FACTORY_TOOLS_TRUSTED_CALLER_LIVE_NOT_PROVEN","DEDICATED_PROJECT_TUNNEL_IDENTITY_LIVE_NOT_PROVEN","AUTHORIZATION_V2_LIVE_CUTOVER_NOT_PROVEN","MTLS_STAGING_NOT_PROVEN"],"last_verified_gate":{"evidence_refs":[{"kind":"BUNDLE_OBJECT","path":"governance/csg/v49/gov-hardening-p4-current-attempt-fence-accepted-v1.json","digest":"sha256:265a44948ac3c527e7c1b0a7baf9baeefd82e9797e6aca9656418a9f962f931f"}],"gate_id":"GOV-HARDENING-P4-CURRENT-ATTEMPT-FENCE","verdict":"PASS_PREPRODUCTION_END_TO_END_ATTEMPT_FENCING_TRUSTED_CALLER_IDENTITY_STILL_OPEN"},"next_legal_transition":{"action":"RUN_P5_NPM_DIAGNOSTICS_PROCESS_RETRY_001","unit_id":"GOV-HARDENING-P5","requires":["P5_REGISTRY_HEAD_200","P5_A24_CACHE_EMPTY","HOST_EXEC_LANE_IDLE"],"forbidden":["USE_START_PROCESS_FOR_NPM","USE_NPM_CMD_WRAPPER","USE_SYSTEM_DEFAULT_NPM_CACHE","MUTATE_LIVE_P4_FACTORY_FILES","MUTATE_LIVE_P4_TASKS","MERGE_PR220_BEFORE_LIVE_CANARIES","PRODUCTION","PAID_FALLBACK","FORCE_UPDATE"]},"authorization_mode":{"mode":"DURABLE_AUTHORIZATION_ENVELOPE","envelope_ref":{"kind":"BUNDLE_OBJECT","path":"governance/csg/v49/authorization-envelope-current.json","digest":"sha256:cb614427a0a1755d002cd035f50d33b18208bab7e5a9d8efc42dfbc7c4d99d14"},"do_not_reask_for":["REVERSIBLE_BOUNDED_PLAN_INTERNAL_REPAIRS","QUALIFIED_ACCEPTED_SOURCE_DEPLOYMENTS_WITH_EXACT_FENCE_READBACK_ROLLBACK","GOVERNANCE_HARDENING_WITHIN_CURRENT_MISSION"],"human_reserved":["MISSION_CHANGE","PRODUCTION_FINAL_AUTHORIZATION","NEW_COST_OR_PAID_FALLBACK","LEGAL_OR_FINANCIAL_OR_SIGNATURE","OAUTH_OR_MFA","MAJOR_IRREVERSIBLE_OR_HIGH_RISK","TRULY_MISSING_REAL_WORLD_INFO","CODEX_LAST_MILE"],"barrier":"ACTIVE_UNIT","recorded_at":"2026-09-22T00:31:00Z","evidence_refs":[{"kind":"BUNDLE_OBJECT","path":"governance/csg/v49/gov-hardening-p5-npm-cache-network-diagnostic-150-v1.json","digest":"sha256:cce892e78d59a679bb1ab1290c78f42b05706e3d4b6f1017bb83761daadee6ad"}]},"stop_requested":false,"barrier":"ACTIVE_UNIT","evidence_refs":[{"kind":"BUNDLE_OBJECT","path":"governance/csg/v49/gov-hardening-p5-npm-cache-network-diagnostic-150-v1.json","digest":"sha256:cce892e78d59a679bb1ab1290c78f42b05706e3d4b6f1017bb83761daadee6ad"}],"recorded_at":"2026-09-22T00:31:00Z","payload_digest":"sha256:0b4b10eb9f4cb1b2c7dc8a9c7bad115f14a7725a1ee2d9ce9bf8f6a41675246d"}