{"schema_version":"csg.checkpoint.v1","project_id":"CHATGPT_GLOBAL_SKILL_GOVERNANCE","checkpoint_seq":152,"transition_id":"GOV-HARDENING-P5-WINDOWS-STAGING-REGRESSION-152","previous_checkpoint_ref":{"kind":"EXTERNAL_IMMUTABLE","provider":"GitHub","repository_id_or_resource_id":"1352411536","revision":"d9a5120faaae8523dc4d6c051687143779aaff9f","path":"governance/csg/checkpoints/000151.json","digest":"sha256:0b4b10eb9f4cb1b2c7dc8a9c7bad115f14a7725a1ee2d9ce9bf8f6a41675246d"},"migration_anchor":null,"event":{"type":"ATOMIC_STARTED","reason_code":"P5_STAGED_DEPENDENCY_INSTALL_PASS_ARM_WINDOWS_STAGING_REGRESSION","subject_id":"GOV-HARDENING-P5"},"mission_anchor":{"ref":"github://1352411536/governance/v49/current-mission.json@c57dd50c9c27b217fbd6dd2e4b38c7f7a3ddcd18","revision":"20260919T010100+0800","declared_hash":"sha256:58f21a0818bd60b61929925b38ea8507d5b80c09d816a7b6f5a75d2a410d542b","canonicalization_version":"HUMAN_TEXT_V1"},"policy_anchor":{"ref":"github://1352411536/governance/v49/current-execution-policy.json@c57dd50c9c27b217fbd6dd2e4b38c7f7a3ddcd18","revision":"20260919T010100+0800-EP71","declared_hash":"sha256:0dc535adfcf8c0bf1c12b1ff5e5191f5b74f267143403a41d77d626889eba861","canonicalization_version":"HUMAN_TEXT_V1"},"controller_contract":"CHAT_EXECUTION_POLICY_CONTRACT_V9_1_CANDIDATE","verifier_digest":"sha256:01cbbab08d423294e42dec679b46e5ebef9d06d2f1c3965de8f2bfb25711d4bf","lifecycle":"ACTIVE","owner":null,"run_ref":{"kind":"EXTERNAL_IMMUTABLE","provider":"GitHub","repository_id_or_resource_id":"1352411536","revision":"c57dd50c9c27b217fbd6dd2e4b38c7f7a3ddcd18","path":"runs/V49-CLOSURE-001/run.json","digest":"sha256:ab7916e3064473a38a45857b185bbedaea2d94bdab3196f2fe9b03be11ed599c"},"task_id":"GOV-HARDENING-P5","attempt_id":"GOV-HARDENING-P5-ATTEMPT-029","attempt_epoch":29,"atomic":{"contract_ref":{"kind":"HUMAN_DIRECTIVE","ref":"HUMAN_INDEPENDENT_GOVERNANCE_AUDIT_20260921"},"deadline_at":null,"state":"IN_PROGRESS","unit_id":"GOV-HARDENING-P5","goal":"P5_WINDOWS_PARALLEL_STAGING_REGRESSION","acceptance":["DEPENDENCY_INSTALL_MARKER_PASS","PACKAGE_LOCK_HASH_STABLE","POWERSHELL_PARSE_PASS","ALL_MJS_NODE_CHECK_PASS","PROTOCOL_SMOKE_PASS","CONTROL_LANE_SOURCE_PASS","TUNNEL_SUPERVISOR_SOURCE_PASS","AUTH_AND_EXECUTION_NODE_TEST_PASS","OPERATION_CLAIM_WINDOWS_PASS","LIVE_P4_ROUTE_UNCHANGED"],"execution_fence":{"schema":"v49.factory-mcp.execution-fence.v1","project_id":"CHATGPT_GLOBAL_SKILL_GOVERNANCE","mission_revision":"20260919T010100+0800","mission_hash":"sha256:58f21a0818bd60b61929925b38ea8507d5b80c09d816a7b6f5a75d2a410d542b","authorization_envelope_digest":"sha256:cb614427a0a1755d002cd035f50d33b18208bab7e5a9d8efc42dfbc7c4d99d14","run_id":"CHATGPT_GLOBAL_SKILL_GOVERNANCE-QUAL-P5","task_id":"GOV-HARDENING-P5","attempt_id":"GOV-HARDENING-P5-ATTEMPT-029","attempt_epoch":29,"operation_id":"GOV-HARDENING-P5-WINDOWS-STAGING-REGRESSION-001","operation_kind":"HOST_POWERSHELL","script_sha256":"sha256:1a3d94692920f47ba2d254ea4ac454ebf3d686f0ded06a7a479e3b58275b7f72","timeout_seconds":180,"capability_generation":4,"expires_at":"2026-09-22T05:00:00Z"}},"last_accepted":{"acceptance_transition_id":"GOV-HARDENING-P4-ACCEPTED-123","checkpoint_seq":123,"evidence_refs":[{"kind":"BUNDLE_OBJECT","path":"governance/csg/v49/gov-hardening-p4-current-attempt-fence-accepted-v1.json","digest":"sha256:265a44948ac3c527e7c1b0a7baf9baeefd82e9797e6aca9656418a9f962f931f"}],"unit_id":"GOV-HARDENING-P4"},"remote_wip":{"kind":"GITHUB_BRANCH","ref":"refs/heads/v49-p5-trusted-caller-authgen-candidate-20260921","head":"1f44bb9927cbc8b765d223c84d38757b0dd6c7e8","state":"P5_WINDOWS_PARALLEL_STAGING_REGRESSION"},"active_job_refs":[],"unresolved_effect_refs":[],"blockers":["P5_WINDOWS_STAGING_REGRESSION_REQUIRED","DURABLE_OPERATION_CONSUMPTION_LIVE_NOT_PROVEN","ALL_MUTATING_FACTORY_TOOLS_TRUSTED_CALLER_LIVE_NOT_PROVEN","DEDICATED_PROJECT_TUNNEL_IDENTITY_LIVE_NOT_PROVEN","AUTHORIZATION_V2_LIVE_CUTOVER_NOT_PROVEN","MTLS_STAGING_NOT_PROVEN"],"last_verified_gate":{"evidence_refs":[{"kind":"BUNDLE_OBJECT","path":"governance/csg/v49/gov-hardening-p4-current-attempt-fence-accepted-v1.json","digest":"sha256:265a44948ac3c527e7c1b0a7baf9baeefd82e9797e6aca9656418a9f962f931f"}],"gate_id":"GOV-HARDENING-P4-CURRENT-ATTEMPT-FENCE","verdict":"PASS_PREPRODUCTION_END_TO_END_ATTEMPT_FENCING_TRUSTED_CALLER_IDENTITY_STILL_OPEN"},"next_legal_transition":{"action":"RUN_P5_WINDOWS_STAGING_REGRESSION_001","unit_id":"GOV-HARDENING-P5","requires":["P5_STAGED_DEPENDENCY_INSTALL_PASS","HOST_EXEC_LANE_IDLE"],"forbidden":["MUTATE_LIVE_P4_FACTORY_FILES","MUTATE_LIVE_P4_TASKS","START_P5_HTTP_MTLS_BEFORE_STAGE_REGRESSION","MERGE_PR220_BEFORE_LIVE_CANARIES","PRODUCTION","PAID_FALLBACK","FORCE_UPDATE"]},"authorization_mode":{"mode":"DURABLE_AUTHORIZATION_ENVELOPE","envelope_ref":{"kind":"BUNDLE_OBJECT","path":"governance/csg/v49/authorization-envelope-current.json","digest":"sha256:cb614427a0a1755d002cd035f50d33b18208bab7e5a9d8efc42dfbc7c4d99d14"},"do_not_reask_for":["REVERSIBLE_BOUNDED_PLAN_INTERNAL_REPAIRS","QUALIFIED_ACCEPTED_SOURCE_DEPLOYMENTS_WITH_EXACT_FENCE_READBACK_ROLLBACK","GOVERNANCE_HARDENING_WITHIN_CURRENT_MISSION"],"human_reserved":["MISSION_CHANGE","PRODUCTION_FINAL_AUTHORIZATION","NEW_COST_OR_PAID_FALLBACK","LEGAL_OR_FINANCIAL_OR_SIGNATURE","OAUTH_OR_MFA","MAJOR_IRREVERSIBLE_OR_HIGH_RISK","TRULY_MISSING_REAL_WORLD_INFO","CODEX_LAST_MILE"],"barrier":"ACTIVE_UNIT","recorded_at":"2026-09-22T00:36:00Z","evidence_refs":[{"kind":"BUNDLE_OBJECT","path":"governance/csg/v49/gov-hardening-p5-staged-dependency-install-pass-151-v1.json","digest":"sha256:64daacf3db185226d14a9b9f9afd14d93e43db5bacf4fa0bc3db4b56185af50d"}]},"stop_requested":false,"barrier":"ACTIVE_UNIT","evidence_refs":[{"kind":"BUNDLE_OBJECT","path":"governance/csg/v49/gov-hardening-p5-staged-dependency-install-pass-151-v1.json","digest":"sha256:64daacf3db185226d14a9b9f9afd14d93e43db5bacf4fa0bc3db4b56185af50d"}],"recorded_at":"2026-09-22T00:36:00Z","payload_digest":"sha256:5b7491ecd7f3fa9c4d3a7a57c8807bc2c0306d407c5dce06a14cb561b28da5cd"}