{"schema_version":"csg.checkpoint.v1","project_id":"CHATGPT_GLOBAL_SKILL_GOVERNANCE","checkpoint_seq":114,"transition_id":"GOV-HARDENING-P0-ACCEPTED-114","previous_checkpoint_ref":{"kind":"EXTERNAL_IMMUTABLE","provider":"GitHub","repository_id_or_resource_id":"1352411536","revision":"f50716c2deee9303147633bdf3e55c57b6845e63","path":"governance/csg/checkpoints/000113.json","digest":"sha256:b90bc2582a67bcd7525a86ae90fe008087e9376d775eee7cdc040632b0bc7214"},"migration_anchor":null,"event":{"type":"ATOMIC_ACCEPTED","reason_code":"FACTORY_TIMEOUT_ORPHAN_TERMINALIZATION_DEPLOYED_VERIFIED","subject_id":"GOV-HARDENING-P0"},"mission_anchor":{"ref":"github://1352411536/governance/v49/current-mission.json@c57dd50c9c27b217fbd6dd2e4b38c7f7a3ddcd18","revision":"20260919T010100+0800","declared_hash":"sha256:58f21a0818bd60b61929925b38ea8507d5b80c09d816a7b6f5a75d2a410d542b","canonicalization_version":"HUMAN_TEXT_V1"},"policy_anchor":{"ref":"github://1352411536/governance/v49/current-execution-policy.json@c57dd50c9c27b217fbd6dd2e4b38c7f7a3ddcd18","revision":"20260919T010100+0800-EP71","declared_hash":"sha256:0dc535adfcf8c0bf1c12b1ff5e5191f5b74f267143403a41d77d626889eba861","canonicalization_version":"HUMAN_TEXT_V1"},"controller_contract":"CHAT_EXECUTION_POLICY_CONTRACT_V9_1_CANDIDATE","verifier_digest":"sha256:01cbbab08d423294e42dec679b46e5ebef9d06d2f1c3965de8f2bfb25711d4bf","lifecycle":"ACTIVE","owner":null,"run_ref":{"kind":"EXTERNAL_IMMUTABLE","provider":"GitHub","repository_id_or_resource_id":"1352411536","revision":"c57dd50c9c27b217fbd6dd2e4b38c7f7a3ddcd18","path":"runs/V49-CLOSURE-001/run.json","digest":"sha256:ab7916e3064473a38a45857b185bbedaea2d94bdab3196f2fe9b03be11ed599c"},"task_id":"GOV-HARDENING-P0","attempt_id":"GOV-HARDENING-P0-ATTEMPT-001","attempt_epoch":1,"atomic":{"contract_ref":{"kind":"HUMAN_DIRECTIVE","ref":"HUMAN_ATTACHED_INCIDENT_CORPUS_20260921"},"deadline_at":null,"state":"COMPLETED","unit_id":"GOV-HARDENING-P0"},"last_accepted":{"acceptance_transition_id":"GOV-HARDENING-P0-ACCEPTED-114","checkpoint_seq":114,"evidence_refs":[{"kind":"BUNDLE_OBJECT","path":"governance/csg/v49/gov-hardening-p0-factory-timeout-orphan-accepted-v1.json","digest":"sha256:a6d43e5a6817f5059d2e6f01393da8a78fb5353fa8056a4bf0ce8cba109d2402"}],"unit_id":"GOV-HARDENING-P0"},"remote_wip":{"kind":"GITHUB_BRANCH","ref":"refs/heads/v49-12-real-builder-wip-20260919","head":"659f721786a4daab94a52cdbb6498be4a965488d","state":"V49_13_QUEUED_PENDING_GOV_HARDENING"},"active_job_refs":[],"unresolved_effect_refs":[],"blockers":[],"last_verified_gate":{"evidence_refs":[{"kind":"BUNDLE_OBJECT","path":"governance/csg/v49/gov-hardening-p0-factory-timeout-orphan-accepted-v1.json","digest":"sha256:a6d43e5a6817f5059d2e6f01393da8a78fb5353fa8056a4bf0ce8cba109d2402"}],"gate_id":"GOV-HARDENING-P0-FACTORY-RUNTIME","verdict":"PASS_TIMEOUT_ORPHAN_TERMINALIZATION_DEPLOYED_AND_READBACK"},"next_legal_transition":{"action":"START_GOV_HARDENING_P1_AUTHORIZATION_ENVELOPE","unit_id":"GOV-HARDENING-P1","requires":["GOV_HARDENING_P0_ACCEPTED","CURRENT_MISSION_UNCHANGED","POLICY_EP71_CURRENT","DIRECT_PARENT_NON_FORCE_SHARED_MUTATION"],"forbidden":["START_V49_13_BEFORE_HARDENING_ACCEPTED","PRODUCTION","PAID_FALLBACK","FORCE_UPDATE","CROSS_PROJECT_BUSINESS_MUTATION"]},"authorization_mode":{"mode":"GOAL_AUTO_CONTINUE_WITHIN_APPROVED_PREPRODUCTION_PLAN","do_not_reask_for":["REVERSIBLE_BOUNDED_PLAN_INTERNAL_REPAIRS","QUALIFIED_ACCEPTED_SOURCE_DEPLOYMENTS_WITH_EXACT_FENCE_READBACK_ROLLBACK","GOVERNANCE_HARDENING_WITHIN_CURRENT_MISSION"],"human_reserved":["MISSION_CHANGE","PRODUCTION_FINAL_AUTHORIZATION","NEW_COST_OR_PAID_FALLBACK","LEGAL_OR_FINANCIAL_OR_SIGNATURE","OAUTH_OR_MFA","MAJOR_IRREVERSIBLE_OR_HIGH_RISK","TRULY_MISSING_REAL_WORLD_INFO"]},"stop_requested":false,"barrier":"CLEAN","evidence_refs":[{"kind":"BUNDLE_OBJECT","path":"governance/csg/v49/gov-hardening-p0-factory-timeout-orphan-accepted-v1.json","digest":"sha256:a6d43e5a6817f5059d2e6f01393da8a78fb5353fa8056a4bf0ce8cba109d2402"}],"recorded_at":"2026-09-21T05:29:30Z","payload_digest":"sha256:22f24522b93a0cc2e3fc954f4f2916050fcbb0b303a152dcb1bd20a01efce086"}