{"schema_version":"csg.checkpoint.v1","project_id":"CHATGPT_GLOBAL_SKILL_GOVERNANCE","checkpoint_seq":124,"transition_id":"GOV-HARDENING-P5-STARTED-124","previous_checkpoint_ref":{"kind":"EXTERNAL_IMMUTABLE","provider":"GitHub","repository_id_or_resource_id":"1352411536","revision":"92fbd80293ad3ef04c10430a3216f22a86a703f5","path":"governance/csg/checkpoints/000123.json","digest":"sha256:9f8e59f1c8ae03140eea7eb4b239aca5689c6dd8a09523499b6354cf5f1032cb"},"migration_anchor":null,"event":{"type":"ATOMIC_STARTED","reason_code":"START_TRUSTED_CALLER_AND_AUTHORIZATION_GENERATION_HARDENING","subject_id":"GOV-HARDENING-P5"},"mission_anchor":{"ref":"github://1352411536/governance/v49/current-mission.json@c57dd50c9c27b217fbd6dd2e4b38c7f7a3ddcd18","revision":"20260919T010100+0800","declared_hash":"sha256:58f21a0818bd60b61929925b38ea8507d5b80c09d816a7b6f5a75d2a410d542b","canonicalization_version":"HUMAN_TEXT_V1"},"policy_anchor":{"ref":"github://1352411536/governance/v49/current-execution-policy.json@c57dd50c9c27b217fbd6dd2e4b38c7f7a3ddcd18","revision":"20260919T010100+0800-EP71","declared_hash":"sha256:0dc535adfcf8c0bf1c12b1ff5e5191f5b74f267143403a41d77d626889eba861","canonicalization_version":"HUMAN_TEXT_V1"},"controller_contract":"CHAT_EXECUTION_POLICY_CONTRACT_V9_1_CANDIDATE","verifier_digest":"sha256:01cbbab08d423294e42dec679b46e5ebef9d06d2f1c3965de8f2bfb25711d4bf","lifecycle":"ACTIVE","owner":null,"run_ref":{"kind":"EXTERNAL_IMMUTABLE","provider":"GitHub","repository_id_or_resource_id":"1352411536","revision":"c57dd50c9c27b217fbd6dd2e4b38c7f7a3ddcd18","path":"runs/V49-CLOSURE-001/run.json","digest":"sha256:ab7916e3064473a38a45857b185bbedaea2d94bdab3196f2fe9b03be11ed599c"},"task_id":"GOV-HARDENING-P5","attempt_id":"GOV-HARDENING-P5-ATTEMPT-001","attempt_epoch":1,"atomic":{"contract_ref":{"kind":"HUMAN_DIRECTIVE","ref":"HUMAN_INDEPENDENT_GOVERNANCE_AUDIT_20260921"},"deadline_at":null,"state":"IN_PROGRESS","unit_id":"GOV-HARDENING-P5","goal":"TRUSTED_CALLER_PROJECT_IDENTITY_AND_AUTHORIZATION_GENERATION","acceptance":["STDIO_STATIC_PROJECT_IDENTITY_REMOVED_FROM_PRODUCTION_PATH","TRUSTED_CALLER_IDENTITY_VERIFIED_BEFORE_SYSTEM_DISPATCH","PROJECT_ID_DERIVED_FROM_TRUSTED_IDENTITY_NOT_CALLER_NAMESPACE","AUTHORIZATION_GENERATION_AND_REVOCATION_FENCE_IMPLEMENTED","VALID_PROJECT_CALLER_CANARY_PASSES","UNTRUSTED_CALLER_VALID_NAMESPACE_FAILS_CLOSED"],"execution_fence":{"schema":"v49.factory-mcp.execution-fence.v1","project_id":"CHATGPT_GLOBAL_SKILL_GOVERNANCE","mission_revision":"20260919T010100+0800","mission_hash":"sha256:58f21a0818bd60b61929925b38ea8507d5b80c09d816a7b6f5a75d2a410d542b","authorization_envelope_digest":"sha256:cb614427a0a1755d002cd035f50d33b18208bab7e5a9d8efc42dfbc7c4d99d14","run_id":"CHATGPT_GLOBAL_SKILL_GOVERNANCE-QUAL-P5","task_id":"GOV-HARDENING-P5","attempt_id":"GOV-HARDENING-P5-ATTEMPT-001","attempt_epoch":1,"operation_id":"GOV-HARDENING-P5-PREFLIGHT-001","operation_kind":"HOST_POWERSHELL","script_sha256":"sha256:d179e28c5519adb5def427d2d948b307407d9056f849f6fd9078c91acf68e050","timeout_seconds":30,"capability_generation":4,"expires_at":"2026-09-21T18:00:00Z"}},"last_accepted":{"acceptance_transition_id":"GOV-HARDENING-P4-ACCEPTED-123","checkpoint_seq":123,"evidence_refs":[{"kind":"BUNDLE_OBJECT","path":"governance/csg/v49/gov-hardening-p4-current-attempt-fence-accepted-v1.json","digest":"sha256:265a44948ac3c527e7c1b0a7baf9baeefd82e9797e6aca9656418a9f962f931f"}],"unit_id":"GOV-HARDENING-P4"},"remote_wip":{"kind":"GITHUB_BRANCH","ref":"refs/heads/v49-12-real-builder-wip-20260919","head":"659f721786a4daab94a52cdbb6498be4a965488d","state":"V49_13_QUEUED_GOV_HARDENING_P5_ACTIVE"},"active_job_refs":[],"unresolved_effect_refs":[],"blockers":["TRUSTED_CALLER_PROJECT_IDENTITY_NOT_PROVEN","AUTHORIZATION_ENVELOPE_CHAT_CONTINUITY_CONTROLLER_INTEGRATION_PARTIAL","AUTHORIZATION_REVOCATION_GENERATION_MISSING","POST_HARDENING_REBOOT_COLD_START_NOT_VERIFIED","LEGACY_EXECUTION_SURFACES_NOT_FULLY_CLASSIFIED","RECEIPT_RETENTION_COMPACTION_MISSING","BROKER_RESTART_CHILD_LIVENESS_NOT_PROVEN","PROVIDER_OBSERVATION_TYPED_RECEIPT_PARTIAL","CAPABILITY_GRAPH_INFRA_DEPENDENCY_FOUR_WAY_LIVENESS_PARTIAL"],"last_verified_gate":{"evidence_refs":[{"kind":"BUNDLE_OBJECT","path":"governance/csg/v49/gov-hardening-p4-current-attempt-fence-accepted-v1.json","digest":"sha256:265a44948ac3c527e7c1b0a7baf9baeefd82e9797e6aca9656418a9f962f931f"}],"gate_id":"GOV-HARDENING-P4-CURRENT-ATTEMPT-FENCE","verdict":"PASS_PREPRODUCTION_END_TO_END_ATTEMPT_FENCING_TRUSTED_CALLER_IDENTITY_STILL_OPEN"},"next_legal_transition":{"action":"QUALIFY_GOV_HARDENING_P5_TRUSTED_CALLER_TRANSPORT_AND_AUTHORIZATION_GENERATION","unit_id":"GOV-HARDENING-P5","requires":["P4_ACCEPTED","NO_UNRESOLVED_EFFECTS","ACCEPTED_SOURCE_7189C7CA"],"forbidden":["V49_13_RESUME_BEFORE_P5_ACCEPTED","PRODUCTION","PAID_FALLBACK","FORCE_UPDATE","CROSS_PROJECT_BUSINESS_MUTATION","MULTITENANT_PRODUCTION_SYSTEM_AUTHORITY_WITHOUT_TRUSTED_CALLER_IDENTITY"]},"authorization_mode":{"mode":"DURABLE_AUTHORIZATION_ENVELOPE","envelope_ref":{"kind":"BUNDLE_OBJECT","path":"governance/csg/v49/authorization-envelope-current.json","digest":"sha256:cb614427a0a1755d002cd035f50d33b18208bab7e5a9d8efc42dfbc7c4d99d14"},"do_not_reask_for":["REVERSIBLE_BOUNDED_PLAN_INTERNAL_REPAIRS","QUALIFIED_ACCEPTED_SOURCE_DEPLOYMENTS_WITH_EXACT_FENCE_READBACK_ROLLBACK","GOVERNANCE_HARDENING_WITHIN_CURRENT_MISSION"],"human_reserved":["MISSION_CHANGE","PRODUCTION_FINAL_AUTHORIZATION","NEW_COST_OR_PAID_FALLBACK","LEGAL_OR_FINANCIAL_OR_SIGNATURE","OAUTH_OR_MFA","MAJOR_IRREVERSIBLE_OR_HIGH_RISK","TRULY_MISSING_REAL_WORLD_INFO","CODEX_LAST_MILE"]},"stop_requested":false,"barrier":"ACTIVE_UNIT","evidence_refs":[{"kind":"BUNDLE_OBJECT","path":"governance/csg/v49/gov-hardening-p4-current-attempt-fence-accepted-v1.json","digest":"sha256:265a44948ac3c527e7c1b0a7baf9baeefd82e9797e6aca9656418a9f962f931f"}],"recorded_at":"2026-09-21T10:30:00Z","payload_digest":"sha256:768bae26ff8248d3d9ce93246ee4b505a023efdd7724e5ca6c37d32dc32c15f0"}