{"schema_version":"csg.checkpoint.v1","project_id":"CHATGPT_GLOBAL_SKILL_GOVERNANCE","checkpoint_seq":164,"transition_id":"GOV-HARDENING-P5-WINDOWS-MTLS-RECOVERY-CLEAN-164","previous_checkpoint_ref":{"kind":"EXTERNAL_IMMUTABLE","provider":"GitHub","repository_id_or_resource_id":"1352411536","revision":"23559eb39eee70f83ddf2cf9b40fbd6953e2f546","path":"governance/csg/checkpoints/000163.json","digest":"sha256:51c7104ae002f9c6add47c89133c3c844160c0b4e73acb300406fa232302630b"},"migration_anchor":null,"event":{"type":"EFFECT_RECONCILED","reason_code":"P5_WINDOWS_MTLS_TIMEOUT_PARTIAL_RESIDUE_CLEANED","subject_id":"GOV-HARDENING-P5-WINDOWS-MTLS-STAGING-001"},"mission_anchor":{"ref":"github://1352411536/governance/v49/current-mission.json@c57dd50c9c27b217fbd6dd2e4b38c7f7a3ddcd18","revision":"20260919T010100+0800","declared_hash":"sha256:58f21a0818bd60b61929925b38ea8507d5b80c09d816a7b6f5a75d2a410d542b","canonicalization_version":"HUMAN_TEXT_V1"},"policy_anchor":{"ref":"github://1352411536/governance/v49/current-execution-policy.json@c57dd50c9c27b217fbd6dd2e4b38c7f7a3ddcd18","revision":"20260919T010100+0800-EP71","declared_hash":"sha256:0dc535adfcf8c0bf1c12b1ff5e5191f5b74f267143403a41d77d626889eba861","canonicalization_version":"HUMAN_TEXT_V1"},"controller_contract":"CHAT_EXECUTION_POLICY_CONTRACT_V9_1_CANDIDATE","verifier_digest":"sha256:01cbbab08d423294e42dec679b46e5ebef9d06d2f1c3965de8f2bfb25711d4bf","lifecycle":"ACTIVE","owner":null,"run_ref":{"kind":"EXTERNAL_IMMUTABLE","provider":"GitHub","repository_id_or_resource_id":"1352411536","revision":"c57dd50c9c27b217fbd6dd2e4b38c7f7a3ddcd18","path":"runs/V49-CLOSURE-001/run.json","digest":"sha256:ab7916e3064473a38a45857b185bbedaea2d94bdab3196f2fe9b03be11ed599c"},"task_id":"GOV-HARDENING-P5","attempt_id":"GOV-HARDENING-P5-ATTEMPT-041","attempt_epoch":41,"atomic":{"contract_ref":{"kind":"HUMAN_DIRECTIVE","ref":"HUMAN_CONTINUE_GOVERNANCE_REPAIR_20260922"},"state":"IN_PROGRESS","unit_id":"GOV-HARDENING-P5","goal":"RECONSTRUCT_DURABLE_WINDOWS_MTLS_STAGING_SCRIPT_FROM_VERIFIED_SOURCE"},"last_accepted":{"acceptance_transition_id":"GOV-HARDENING-P4-ACCEPTED-123","checkpoint_seq":123,"evidence_refs":[{"kind":"BUNDLE_OBJECT","path":"governance/csg/v49/gov-hardening-p4-current-attempt-fence-accepted-v1.json","digest":"sha256:265a44948ac3c527e7c1b0a7baf9baeefd82e9797e6aca9656418a9f962f931f"}],"unit_id":"GOV-HARDENING-P4"},"remote_wip":{"kind":"GITHUB_BRANCH","ref":"refs/heads/v49-p5-trusted-caller-authgen-candidate-20260921","head":"1f44bb9927cbc8b765d223c84d38757b0dd6c7e8","state":"P5_WINDOWS_MTLS_STAGING_SCRIPT_DURABILITY_RECONSTRUCTION"},"active_job_refs":[],"unresolved_effect_refs":[],"blockers":["P5_WINDOWS_MTLS_STAGING_SCRIPT_DURABILITY_REQUIRED","DURABLE_OPERATION_CONSUMPTION_LIVE_NOT_PROVEN","ALL_MUTATING_FACTORY_TOOLS_TRUSTED_CALLER_LIVE_NOT_PROVEN","DEDICATED_PROJECT_TUNNEL_IDENTITY_LIVE_NOT_PROVEN","AUTHORIZATION_V2_LIVE_CUTOVER_NOT_PROVEN"],"last_verified_gate":{"evidence_refs":[{"kind":"BUNDLE_OBJECT","path":"governance/csg/v49/gov-hardening-p4-current-attempt-fence-accepted-v1.json","digest":"sha256:265a44948ac3c527e7c1b0a7baf9baeefd82e9797e6aca9656418a9f962f931f"}],"gate_id":"GOV-HARDENING-P4-CURRENT-ATTEMPT-FENCE","verdict":"PASS_PREPRODUCTION_END_TO_END_ATTEMPT_FENCING_TRUSTED_CALLER_IDENTITY_STILL_OPEN"},"next_legal_transition":{"action":"RECONSTRUCT_P5_WINDOWS_MTLS_STAGING_SCRIPT_FROM_VERIFIED_SOURCE","unit_id":"GOV-HARDENING-P5","requires":["P5_TIMEOUT_RESIDUE_CLEAN","ORIGINAL_STAGING_TEMP_SCRIPT_ABSENT","P5_CANDIDATE_SOURCE_QUALIFIED","LIVE_P4_ROUTE_HEALTHY"],"forbidden":["REDISPATCH_ORIGINAL_STAGING_OPERATION","HOST_POWERSHELL_MUTATION_BEFORE_DURABLE_STAGING_SCRIPT","MERGE_PR220_BEFORE_LIVE_CANARIES","PRODUCTION","PAID_FALLBACK","FORCE_UPDATE"]},"authorization_mode":{"mode":"DURABLE_AUTHORIZATION_ENVELOPE","envelope_ref":{"kind":"BUNDLE_OBJECT","path":"governance/csg/v49/authorization-envelope-current.json","digest":"sha256:cb614427a0a1755d002cd035f50d33b18208bab7e5a9d8efc42dfbc7c4d99d14"},"do_not_reask_for":["REVERSIBLE_BOUNDED_PLAN_INTERNAL_REPAIRS","QUALIFIED_ACCEPTED_SOURCE_DEPLOYMENTS_WITH_EXACT_FENCE_READBACK_ROLLBACK","GOVERNANCE_HARDENING_WITHIN_CURRENT_MISSION"],"human_reserved":["MISSION_CHANGE","PRODUCTION_FINAL_AUTHORIZATION","NEW_COST_OR_PAID_FALLBACK","LEGAL_OR_FINANCIAL_OR_SIGNATURE","OAUTH_OR_MFA","MAJOR_IRREVERSIBLE_OR_HIGH_RISK","TRULY_MISSING_REAL_WORLD_INFO","CODEX_LAST_MILE"],"barrier":"ACTIVE_UNIT","recorded_at":"2026-09-22T07:09:00Z","evidence_refs":[{"kind":"BUNDLE_OBJECT","path":"governance/csg/v49/gov-hardening-p5-windows-mtls-partial-cleanup-163-v1.json","digest":"sha256:978324af4e9c65ed1d31a6ffdd9e0b15aa44462358d7a631701a3c80e30c6990"}]},"stop_requested":false,"barrier":"ACTIVE_UNIT","evidence_refs":[{"kind":"BUNDLE_OBJECT","path":"governance/csg/v49/gov-hardening-p5-windows-mtls-partial-cleanup-163-v1.json","digest":"sha256:978324af4e9c65ed1d31a6ffdd9e0b15aa44462358d7a631701a3c80e30c6990"}],"recorded_at":"2026-09-22T07:09:00Z","payload_digest":"sha256:e3cf0359e44bdb3cefb1dcf1faa57b885cede982fe379eab9b43cced6404e0f9"}