{"schema_version":"csg.checkpoint.v1","project_id":"CHATGPT_GLOBAL_SKILL_GOVERNANCE","checkpoint_seq":129,"transition_id":"GOV-HARDENING-P5-CODELOAD-NPM-CI-129","previous_checkpoint_ref":{"kind":"EXTERNAL_IMMUTABLE","provider":"GitHub","repository_id_or_resource_id":"1352411536","revision":"97c3f1f7f1fd9e468ff455aca05a3cd0410d0e9b","path":"governance/csg/checkpoints/000128.json","digest":"sha256:16ee7472893079dbe7590a7b3e9f0b8764b225d66978020885711a75472260eb"},"migration_anchor":null,"event":{"type":"ATOMIC_STARTED","reason_code":"NPM_CI_TIMEOUT_READBACK_CONFIRMED_NOT_APPLIED_SWITCH_TO_CODELOAD_ARCHIVE","subject_id":"GOV-HARDENING-P5"},"mission_anchor":{"ref":"github://1352411536/governance/v49/current-mission.json@c57dd50c9c27b217fbd6dd2e4b38c7f7a3ddcd18","revision":"20260919T010100+0800","declared_hash":"sha256:58f21a0818bd60b61929925b38ea8507d5b80c09d816a7b6f5a75d2a410d542b","canonicalization_version":"HUMAN_TEXT_V1"},"policy_anchor":{"ref":"github://1352411536/governance/v49/current-execution-policy.json@c57dd50c9c27b217fbd6dd2e4b38c7f7a3ddcd18","revision":"20260919T010100+0800-EP71","declared_hash":"sha256:0dc535adfcf8c0bf1c12b1ff5e5191f5b74f267143403a41d77d626889eba861","canonicalization_version":"HUMAN_TEXT_V1"},"controller_contract":"CHAT_EXECUTION_POLICY_CONTRACT_V9_1_CANDIDATE","verifier_digest":"sha256:01cbbab08d423294e42dec679b46e5ebef9d06d2f1c3965de8f2bfb25711d4bf","lifecycle":"ACTIVE","owner":null,"run_ref":{"kind":"EXTERNAL_IMMUTABLE","provider":"GitHub","repository_id_or_resource_id":"1352411536","revision":"c57dd50c9c27b217fbd6dd2e4b38c7f7a3ddcd18","path":"runs/V49-CLOSURE-001/run.json","digest":"sha256:ab7916e3064473a38a45857b185bbedaea2d94bdab3196f2fe9b03be11ed599c"},"task_id":"GOV-HARDENING-P5","attempt_id":"GOV-HARDENING-P5-ATTEMPT-006","attempt_epoch":6,"atomic":{"contract_ref":{"kind":"HUMAN_DIRECTIVE","ref":"HUMAN_INDEPENDENT_GOVERNANCE_AUDIT_20260921"},"deadline_at":null,"state":"IN_PROGRESS","unit_id":"GOV-HARDENING-P5","goal":"P5_SOURCE_QUALIFICATION_NPM_CI_VIA_EXACT_CODELOAD_ARCHIVE","acceptance":["CODELOAD_EXACT_COMMIT_ARCHIVE_PRESENT","ARCHIVE_ROOT_BINDS_HEAD_36705F08","NPM_CI_REPRODUCIBLE_PASS","NO_PRODUCTION_EFFECT"],"execution_fence":{"schema":"v49.factory-mcp.execution-fence.v1","project_id":"CHATGPT_GLOBAL_SKILL_GOVERNANCE","mission_revision":"20260919T010100+0800","mission_hash":"sha256:58f21a0818bd60b61929925b38ea8507d5b80c09d816a7b6f5a75d2a410d542b","authorization_envelope_digest":"sha256:cb614427a0a1755d002cd035f50d33b18208bab7e5a9d8efc42dfbc7c4d99d14","run_id":"CHATGPT_GLOBAL_SKILL_GOVERNANCE-QUAL-P5","task_id":"GOV-HARDENING-P5","attempt_id":"GOV-HARDENING-P5-ATTEMPT-006","attempt_epoch":6,"operation_id":"GOV-HARDENING-P5-CODELOAD-NPM-CI-001","operation_kind":"HOST_POWERSHELL","script_sha256":"sha256:a8927bfc1502a9e9ee1a7137258d9209244e2fd378ae9564aa4c41acdf316421","timeout_seconds":180,"capability_generation":4,"expires_at":"2026-09-21T16:30:00Z"}},"last_accepted":{"acceptance_transition_id":"GOV-HARDENING-P4-ACCEPTED-123","checkpoint_seq":123,"evidence_refs":[{"kind":"BUNDLE_OBJECT","path":"governance/csg/v49/gov-hardening-p4-current-attempt-fence-accepted-v1.json","digest":"sha256:265a44948ac3c527e7c1b0a7baf9baeefd82e9797e6aca9656418a9f962f931f"}],"unit_id":"GOV-HARDENING-P4"},"remote_wip":{"kind":"GITHUB_BRANCH","ref":"refs/heads/v49-p5-trusted-caller-authgen-candidate-20260921","head":"36705f08985ff899158c353886f8f05b0a6c3d2d","state":"P5_CODELOAD_NPM_CI_STAGE"},"active_job_refs":[],"unresolved_effect_refs":[],"blockers":["P5_CODELOAD_NPM_CI_STAGE_PENDING","P5_SOURCE_QUALIFICATION_INCOMPLETE","DURABLE_OPERATION_CONSUMPTION_LIVE_NOT_PROVEN","ALL_MUTATING_FACTORY_TOOLS_TRUSTED_CALLER_LIVE_NOT_PROVEN","DEDICATED_PROJECT_TUNNEL_IDENTITY_LIVE_NOT_PROVEN","AUTHORIZATION_V2_LIVE_CUTOVER_NOT_PROVEN","MTLS_STAGING_NOT_PROVEN"],"last_verified_gate":{"evidence_refs":[{"kind":"BUNDLE_OBJECT","path":"governance/csg/v49/gov-hardening-p4-current-attempt-fence-accepted-v1.json","digest":"sha256:265a44948ac3c527e7c1b0a7baf9baeefd82e9797e6aca9656418a9f962f931f"}],"gate_id":"GOV-HARDENING-P4-CURRENT-ATTEMPT-FENCE","verdict":"PASS_PREPRODUCTION_END_TO_END_ATTEMPT_FENCING_TRUSTED_CALLER_IDENTITY_STILL_OPEN"},"next_legal_transition":{"action":"RUN_P5_CODELOAD_NPM_CI_STAGE","unit_id":"GOV-HARDENING-P5","requires":["STAGE1_TIMEOUT_READBACK_SIDE_EFFECT_NOT_APPLIED","PR220_HEAD_36705F08"],"forbidden":["BLIND_RETRY_GIT_CLONE_STAGE","MERGE_PR220_BEFORE_FULL_QUALIFICATION","DEPLOY_P5_OVER_P4_BEFORE_PARALLEL_STAGING","PRODUCTION","PAID_FALLBACK","FORCE_UPDATE"]},"authorization_mode":{"mode":"DURABLE_AUTHORIZATION_ENVELOPE","envelope_ref":{"kind":"BUNDLE_OBJECT","path":"governance/csg/v49/authorization-envelope-current.json","digest":"sha256:cb614427a0a1755d002cd035f50d33b18208bab7e5a9d8efc42dfbc7c4d99d14"},"do_not_reask_for":["REVERSIBLE_BOUNDED_PLAN_INTERNAL_REPAIRS","QUALIFIED_ACCEPTED_SOURCE_DEPLOYMENTS_WITH_EXACT_FENCE_READBACK_ROLLBACK","GOVERNANCE_HARDENING_WITHIN_CURRENT_MISSION"],"human_reserved":["MISSION_CHANGE","PRODUCTION_FINAL_AUTHORIZATION","NEW_COST_OR_PAID_FALLBACK","LEGAL_OR_FINANCIAL_OR_SIGNATURE","OAUTH_OR_MFA","MAJOR_IRREVERSIBLE_OR_HIGH_RISK","TRULY_MISSING_REAL_WORLD_INFO","CODEX_LAST_MILE"]},"stop_requested":false,"barrier":"ACTIVE_UNIT","evidence_refs":[{"kind":"BUNDLE_OBJECT","path":"governance/csg/v49/gov-hardening-p5-source-qual-timeout-readback-v1.json","digest":"sha256:b0fd96a2803c5901d1e6ffdf880eaa74b7e10a3deedf7d1846ec86dc161c2a71"},{"kind":"BUNDLE_OBJECT","path":"governance/csg/v49/gov-hardening-p5-npm-ci-timeout-readback-v1.json","digest":"sha256:6e20b2b1005935eb632230de6cd836bd4b26b45b07035b845a2e194ce1023a6d"}],"recorded_at":"2026-09-21T14:42:00Z","payload_digest":"sha256:b4ee428df28c6586425a851cf5f1bff43c4d7da86975590d304c1715740d0312"}