{"schema_version":"csg.checkpoint.v1","project_id":"CHATGPT_GLOBAL_SKILL_GOVERNANCE","checkpoint_seq":140,"transition_id":"GOV-HARDENING-P5-NPM-REGISTRY-PROBE-140","previous_checkpoint_ref":{"kind":"EXTERNAL_IMMUTABLE","provider":"GitHub","repository_id_or_resource_id":"1352411536","revision":"7411292ab3935ce91a1be2e5a35192bef67042af","path":"governance/csg/checkpoints/000139.json","digest":"sha256:313c11dc800d1d51f777c43f68150fb7d33ffdf328f0ccbb6f50cc6a8077598a"},"migration_anchor":null,"event":{"type":"ATOMIC_STARTED","reason_code":"NPM_CI_TIMEOUT_SIDE_EFFECT_NOT_APPLIED_ARM_SYSTEM_REGISTRY_PROBE","subject_id":"GOV-HARDENING-P5"},"mission_anchor":{"ref":"github://1352411536/governance/v49/current-mission.json@c57dd50c9c27b217fbd6dd2e4b38c7f7a3ddcd18","revision":"20260919T010100+0800","declared_hash":"sha256:58f21a0818bd60b61929925b38ea8507d5b80c09d816a7b6f5a75d2a410d542b","canonicalization_version":"HUMAN_TEXT_V1"},"policy_anchor":{"ref":"github://1352411536/governance/v49/current-execution-policy.json@c57dd50c9c27b217fbd6dd2e4b38c7f7a3ddcd18","revision":"20260919T010100+0800-EP71","declared_hash":"sha256:0dc535adfcf8c0bf1c12b1ff5e5191f5b74f267143403a41d77d626889eba861","canonicalization_version":"HUMAN_TEXT_V1"},"controller_contract":"CHAT_EXECUTION_POLICY_CONTRACT_V9_1_CANDIDATE","verifier_digest":"sha256:01cbbab08d423294e42dec679b46e5ebef9d06d2f1c3965de8f2bfb25711d4bf","lifecycle":"ACTIVE","owner":null,"run_ref":{"kind":"EXTERNAL_IMMUTABLE","provider":"GitHub","repository_id_or_resource_id":"1352411536","revision":"c57dd50c9c27b217fbd6dd2e4b38c7f7a3ddcd18","path":"runs/V49-CLOSURE-001/run.json","digest":"sha256:ab7916e3064473a38a45857b185bbedaea2d94bdab3196f2fe9b03be11ed599c"},"task_id":"GOV-HARDENING-P5","attempt_id":"GOV-HARDENING-P5-ATTEMPT-017","attempt_epoch":17,"atomic":{"contract_ref":{"kind":"HUMAN_DIRECTIVE","ref":"HUMAN_INDEPENDENT_GOVERNANCE_AUDIT_20260921"},"deadline_at":null,"state":"IN_PROGRESS","unit_id":"GOV-HARDENING-P5","goal":"P5_SYSTEM_NPM_REGISTRY_CONNECTIVITY_PROBE","acceptance":["SYSTEM_NPM_REGISTRY_CONFIG_READBACK","DNS_REGISTRY_NPMJS_ORG_READBACK","HTTPS_REGISTRY_HEAD_READBACK","NPM_PING_BOUNDED_READBACK","NO_PROXY_SECRET_OUTPUT"],"execution_fence":{"schema":"v49.factory-mcp.execution-fence.v1","project_id":"CHATGPT_GLOBAL_SKILL_GOVERNANCE","mission_revision":"20260919T010100+0800","mission_hash":"sha256:58f21a0818bd60b61929925b38ea8507d5b80c09d816a7b6f5a75d2a410d542b","authorization_envelope_digest":"sha256:cb614427a0a1755d002cd035f50d33b18208bab7e5a9d8efc42dfbc7c4d99d14","run_id":"CHATGPT_GLOBAL_SKILL_GOVERNANCE-QUAL-P5","task_id":"GOV-HARDENING-P5","attempt_id":"GOV-HARDENING-P5-ATTEMPT-017","attempt_epoch":17,"operation_id":"GOV-HARDENING-P5-NPM-REGISTRY-PROBE-001","operation_kind":"HOST_POWERSHELL","script_sha256":"sha256:4f11fae8f9df9b9a45a89acbfaa667454da1fea284bedca7db69d50bc6670402","timeout_seconds":30,"capability_generation":4,"expires_at":"2026-09-21T18:00:00Z"}},"last_accepted":{"acceptance_transition_id":"GOV-HARDENING-P4-ACCEPTED-123","checkpoint_seq":123,"evidence_refs":[{"kind":"BUNDLE_OBJECT","path":"governance/csg/v49/gov-hardening-p4-current-attempt-fence-accepted-v1.json","digest":"sha256:265a44948ac3c527e7c1b0a7baf9baeefd82e9797e6aca9656418a9f962f931f"}],"unit_id":"GOV-HARDENING-P4"},"remote_wip":{"kind":"GITHUB_BRANCH","ref":"refs/heads/v49-p5-trusted-caller-authgen-candidate-20260921","head":"1f44bb9927cbc8b765d223c84d38757b0dd6c7e8","state":"P5_SYSTEM_NPM_REGISTRY_PROBE"},"active_job_refs":[],"unresolved_effect_refs":[],"blockers":["P5_NPM_REGISTRY_PROBE_REQUIRED","P5_PARALLEL_STAGE_NPM_CI_NOT_PROVEN","P5_PARALLEL_STAGE_TESTS_NOT_PROVEN","DURABLE_OPERATION_CONSUMPTION_LIVE_NOT_PROVEN","ALL_MUTATING_FACTORY_TOOLS_TRUSTED_CALLER_LIVE_NOT_PROVEN","DEDICATED_PROJECT_TUNNEL_IDENTITY_LIVE_NOT_PROVEN","AUTHORIZATION_V2_LIVE_CUTOVER_NOT_PROVEN","MTLS_STAGING_NOT_PROVEN"],"last_verified_gate":{"evidence_refs":[{"kind":"BUNDLE_OBJECT","path":"governance/csg/v49/gov-hardening-p4-current-attempt-fence-accepted-v1.json","digest":"sha256:265a44948ac3c527e7c1b0a7baf9baeefd82e9797e6aca9656418a9f962f931f"}],"gate_id":"GOV-HARDENING-P4-CURRENT-ATTEMPT-FENCE","verdict":"PASS_PREPRODUCTION_END_TO_END_ATTEMPT_FENCING_TRUSTED_CALLER_IDENTITY_STILL_OPEN"},"next_legal_transition":{"action":"RUN_P5_NPM_REGISTRY_PROBE_001","unit_id":"GOV-HARDENING-P5","requires":["P5_NPM_CI_TIMEOUT_SIDE_EFFECT_NOT_APPLIED","HOST_EXEC_LANE_IDLE","NO_UNRESOLVED_EFFECTS"],"forbidden":["BLIND_RETRY_P5_NPM_CI","OUTPUT_PROXY_SECRET_VALUES","MUTATE_LIVE_P4_FACTORY_FILES","MUTATE_LIVE_P4_TASKS","MERGE_PR220_BEFORE_LIVE_CANARIES","PRODUCTION","PAID_FALLBACK","FORCE_UPDATE"]},"authorization_mode":{"mode":"DURABLE_AUTHORIZATION_ENVELOPE","envelope_ref":{"kind":"BUNDLE_OBJECT","path":"governance/csg/v49/authorization-envelope-current.json","digest":"sha256:cb614427a0a1755d002cd035f50d33b18208bab7e5a9d8efc42dfbc7c4d99d14"},"do_not_reask_for":["REVERSIBLE_BOUNDED_PLAN_INTERNAL_REPAIRS","QUALIFIED_ACCEPTED_SOURCE_DEPLOYMENTS_WITH_EXACT_FENCE_READBACK_ROLLBACK","GOVERNANCE_HARDENING_WITHIN_CURRENT_MISSION"],"human_reserved":["MISSION_CHANGE","PRODUCTION_FINAL_AUTHORIZATION","NEW_COST_OR_PAID_FALLBACK","LEGAL_OR_FINANCIAL_OR_SIGNATURE","OAUTH_OR_MFA","MAJOR_IRREVERSIBLE_OR_HIGH_RISK","TRULY_MISSING_REAL_WORLD_INFO","CODEX_LAST_MILE"]},"stop_requested":false,"barrier":"ACTIVE_UNIT","evidence_refs":[{"kind":"BUNDLE_OBJECT","path":"governance/csg/v49/gov-hardening-p5-npm-ci-timeout-readback-139-v1.json","digest":"sha256:ca29018cdd2dbbe24fb98d9e4eb92a6351ffd10d82d336e46e14c8e86d2a1605"}],"recorded_at":"2026-09-21T17:24:00Z","payload_digest":"sha256:9d641045cdcc8f7a47a72df31767f6b5654ac5be1b05e0dff7c9fc2be77da82a"}