{"schema_version":"csg.checkpoint.v1","project_id":"CHATGPT_GLOBAL_SKILL_GOVERNANCE","checkpoint_seq":119,"transition_id":"GOV-HARDENING-P3-STARTED-119","previous_checkpoint_ref":{"kind":"EXTERNAL_IMMUTABLE","provider":"GitHub","repository_id_or_resource_id":"1352411536","revision":"8dfdfb663dda5099a637ab0ce4d599af123f1f92","path":"governance/csg/checkpoints/000118.json","digest":"sha256:aa54b29153cbcfbb36cf65e0538d224dad6fa218927ec7e6388ad8e5b2dc09bb"},"migration_anchor":null,"event":{"type":"ATOMIC_STARTED","reason_code":"START_PROJECT_SCOPED_SYSTEM_CAPABILITY_SANDBOX","subject_id":"GOV-HARDENING-P3"},"mission_anchor":{"ref":"github://1352411536/governance/v49/current-mission.json@c57dd50c9c27b217fbd6dd2e4b38c7f7a3ddcd18","revision":"20260919T010100+0800","declared_hash":"sha256:58f21a0818bd60b61929925b38ea8507d5b80c09d816a7b6f5a75d2a410d542b","canonicalization_version":"HUMAN_TEXT_V1"},"policy_anchor":{"ref":"github://1352411536/governance/v49/current-execution-policy.json@c57dd50c9c27b217fbd6dd2e4b38c7f7a3ddcd18","revision":"20260919T010100+0800-EP71","declared_hash":"sha256:0dc535adfcf8c0bf1c12b1ff5e5191f5b74f267143403a41d77d626889eba861","canonicalization_version":"HUMAN_TEXT_V1"},"controller_contract":"CHAT_EXECUTION_POLICY_CONTRACT_V9_1_CANDIDATE","verifier_digest":"sha256:01cbbab08d423294e42dec679b46e5ebef9d06d2f1c3965de8f2bfb25711d4bf","lifecycle":"ACTIVE","owner":null,"run_ref":{"kind":"EXTERNAL_IMMUTABLE","provider":"GitHub","repository_id_or_resource_id":"1352411536","revision":"c57dd50c9c27b217fbd6dd2e4b38c7f7a3ddcd18","path":"runs/V49-CLOSURE-001/run.json","digest":"sha256:ab7916e3064473a38a45857b185bbedaea2d94bdab3196f2fe9b03be11ed599c"},"task_id":"GOV-HARDENING-P3","attempt_id":"GOV-HARDENING-P3-ATTEMPT-001","attempt_epoch":1,"atomic":{"contract_ref":{"kind":"HUMAN_DIRECTIVE","ref":"HUMAN_ATTACHED_INCIDENT_CORPUS_20260921"},"deadline_at":null,"state":"IN_PROGRESS","unit_id":"GOV-HARDENING-P3"},"last_accepted":{"acceptance_transition_id":"GOV-HARDENING-P2-ACCEPTED-118","checkpoint_seq":118,"evidence_refs":[{"kind":"BUNDLE_OBJECT","path":"governance/csg/v49/gov-hardening-p2-execution-attempt-accepted-v1.json","digest":"sha256:163b480961c993a55112a2e071bf1c6168701fc5b577dceb23c5c8813639cdd8"}],"unit_id":"GOV-HARDENING-P2"},"remote_wip":{"kind":"GITHUB_BRANCH","ref":"refs/heads/v49-12-real-builder-wip-20260919","head":"659f721786a4daab94a52cdbb6498be4a965488d","state":"V49_13_QUEUED_PENDING_GOV_HARDENING"},"active_job_refs":[],"unresolved_effect_refs":[],"blockers":[],"last_verified_gate":{"evidence_refs":[{"kind":"BUNDLE_OBJECT","path":"governance/csg/v49/gov-hardening-p2-execution-attempt-accepted-v1.json","digest":"sha256:163b480961c993a55112a2e071bf1c6168701fc5b577dceb23c5c8813639cdd8"}],"gate_id":"GOV-HARDENING-P2-EXECUTION-ATTEMPT","verdict":"PASS_FENCED_UNKNOWN_EFFECT_READBACK_FIRST_RECOVERY"},"next_legal_transition":{"action":"IMPLEMENT_PROJECT_SCOPED_SYSTEM_CAPABILITY_SANDBOX","unit_id":"GOV-HARDENING-P3","requires":["DURABLE_AUTHORIZATION_ENVELOPE_CURRENT","EXECUTION_ATTEMPT_CONTRACT_CURRENT","SERVER_SIDE_PROJECT_CAPABILITY_GATE","BROKER_SECONDARY_CAPABILITY_VALIDATION","BUSINESS_NAMESPACE_SYSTEM_DENY","PUBLIC_MCP_TOOL_COUNT_REMAINS_4"],"forbidden":["START_V49_13_BEFORE_HARDENING_ACCEPTED","PRODUCTION","PAID_FALLBACK","UNSCOPED_SYSTEM_AUTHORITY","FORCE_UPDATE","CROSS_PROJECT_BUSINESS_MUTATION"]},"authorization_mode":{"mode":"DURABLE_AUTHORIZATION_ENVELOPE","envelope_ref":{"kind":"BUNDLE_OBJECT","path":"governance/csg/v49/authorization-envelope-current.json","digest":"sha256:cb614427a0a1755d002cd035f50d33b18208bab7e5a9d8efc42dfbc7c4d99d14"},"do_not_reask_for":["REVERSIBLE_BOUNDED_PLAN_INTERNAL_REPAIRS","QUALIFIED_ACCEPTED_SOURCE_DEPLOYMENTS_WITH_EXACT_FENCE_READBACK_ROLLBACK","GOVERNANCE_HARDENING_WITHIN_CURRENT_MISSION"],"human_reserved":["MISSION_CHANGE","PRODUCTION_FINAL_AUTHORIZATION","NEW_COST_OR_PAID_FALLBACK","LEGAL_OR_FINANCIAL_OR_SIGNATURE","OAUTH_OR_MFA","MAJOR_IRREVERSIBLE_OR_HIGH_RISK","TRULY_MISSING_REAL_WORLD_INFO","CODEX_LAST_MILE"]},"stop_requested":false,"barrier":"ACTIVE_UNIT","evidence_refs":[{"kind":"BUNDLE_OBJECT","path":"governance/csg/v49/gov-hardening-p2-execution-attempt-accepted-v1.json","digest":"sha256:163b480961c993a55112a2e071bf1c6168701fc5b577dceb23c5c8813639cdd8"}],"recorded_at":"2026-09-21T05:47:30Z","payload_digest":"sha256:9f63901a8a5998dad0b409af10b71e105c355cb91346a0593c43e2f2f66e9a2e"}